{
  "metadata": {
    "planName": "Eugene Marathon - Moderate Plan",
    "planLevel": "moderate",
    "raceDate": "2026-04-26",
    "raceName": "Eugene Full Marathon",
    "totalWeeks": 15,
    "weeklyHoursTarget": {
      "min": 6,
      "max": 8
    },
    "predictedFinishTime": {
      "min": "3:55:00",
      "max": "4:10:00",
      "target": "4:00:00"
    },
    "generatedAt": "2026-01-15T12:00:00Z"
  },
  "athlete": {
    "recentRace": {
      "distance": "half marathon",
      "time": "1:52:30",
      "date": "2025-10-15"
    },
    "availableDays": {
      "monday": { "available": true, "timeSlot": "morning", "maxDuration": 60 },
      "tuesday": { "available": true, "timeSlot": "evening", "maxDuration": 75 },
      "wednesday": { "available": true, "timeSlot": "morning", "maxDuration": 60 },
      "thursday": { "available": false },
      "friday": { "available": true, "timeSlot": "morning", "maxDuration": 45 },
      "saturday": { "available": true, "timeSlot": "flexible", "maxDuration": 120 },
      "sunday": { "available": true, "timeSlot": "morning", "maxDuration": 180 }
    },
    "weeklyHoursLimit": 7,
    "blockedDates": [
      {
        "startDate": "2026-02-15",
        "endDate": "2026-02-22",
        "reason": "Work travel",
        "type": "rest"
      },
      {
        "startDate": "2026-03-07",
        "endDate": "2026-03-08",
        "reason": "Skiing trip",
        "type": "cross-training",
        "crossTrainingActivity": "Skiing"
      }
    ],
    "athleteAvailability": {
      "runningDays": ["monday", "tuesday", "wednesday", "friday", "saturday", "sunday"],
      "strengthDays": ["tuesday", "thursday", "saturday"],
      "preferredRunTime": "morning",
      "preferredStrengthTime": "evening",
      "preferredLongRunDay": "sunday"
    },
    "goal": "target_time"
  },
  "paceZones": {
    "easy": {
      "min": "10:30",
      "max": "11:30",
      "description": "Conversational pace, should feel comfortable. MP + 1:30-2:30."
    },
    "marathon": {
      "min": "9:00",
      "max": "9:15",
      "description": "Goal race pace (~4:00 marathon)"
    },
    "tempo": {
      "min": "8:20",
      "max": "8:35",
      "description": "Comfortably hard, can speak in short sentences"
    },
    "fiveK": {
      "min": "7:45",
      "max": "8:00",
      "description": "Hard effort, limited speaking"
    },
    "interval": {
      "min": "7:30",
      "max": "7:45",
      "description": "Near max effort for short bursts"
    },
    "recovery": {
      "min": "11:30",
      "max": "12:30",
      "description": "Very easy, active recovery"
    }
  },
  "hrZones": {
    "zone1": {
      "name": "Recovery",
      "minHR": 93,
      "maxHR": 111,
      "percentMaxHR": "50-60%",
      "purpose": "Active recovery, blood flow promotion"
    },
    "zone2": {
      "name": "Aerobic/Easy",
      "minHR": 111,
      "maxHR": 130,
      "percentMaxHR": "60-70%",
      "purpose": "Build aerobic base - 80% of training should be here"
    },
    "zone3": {
      "name": "Tempo",
      "minHR": 130,
      "maxHR": 148,
      "percentMaxHR": "70-80%",
      "purpose": "Improve lactate clearance, marathon pace"
    },
    "zone4": {
      "name": "Threshold",
      "minHR": 148,
      "maxHR": 167,
      "percentMaxHR": "80-90%",
      "purpose": "Raise lactate threshold, race fitness"
    },
    "zone5": {
      "name": "VO2max",
      "minHR": 167,
      "maxHR": 185,
      "percentMaxHR": "90-100%",
      "purpose": "Maximum aerobic capacity - short intervals only"
    }
  },
  "nutritionTargets": {
    "bmr": 1750,
    "baseTDEE": 2400,
    "macros": {
      "protein": { "grams": 150, "percentage": 25 },
      "carbs": { "grams": 300, "percentage": 50 },
      "fat": { "grams": 67, "percentage": 25 }
    },
    "notes": "Base TDEE calculated for lightly active (desk job). Add 80-100 cal/mile for easy runs, 100-120 cal/mile for long runs."
  },
  "weeks": [
    {
      "weekNumber": 1,
      "weeksUntilRace": 15,
      "isRecoveryWeek": false,
      "phase": "base",
      "focus": "Building aerobic foundation, establishing routine",
      "totalMileage": 25,
      "totalHours": 4.5,
      "strengthDays": 3,
      "weeklyNutrition": {
        "dailyCalories": 2800,
        "trainingCaloriesPerDay": 400,
        "macros": {
          "protein": { "grams": 175, "percentage": 25 },
          "carbs": { "grams": 350, "percentage": 50 },
          "fat": { "grams": 78, "percentage": 25 }
        }
      },
      "days": {
        "monday": {
          "date": "2026-01-13",
          "running": { "type": "easy", "title": "Easy Run", "totalDistance": 4, "estimatedDuration": 44, "hrZone": "Zone 2" },
          "strength": { "scheduled": true, "type": "lower_body", "timing": "After run", "duration": 40 }
        },
        "tuesday": {
          "date": "2026-01-14",
          "running": { "type": "intervals", "title": "Strides", "description": "Easy run with 6x100m strides", "totalDistance": 5, "estimatedDuration": 55, "hrZone": "Zone 2 (Zone 4-5 strides)" }
        },
        "wednesday": {
          "date": "2026-01-15",
          "running": { "type": "easy", "title": "Easy Run", "totalDistance": 4, "estimatedDuration": 44, "hrZone": "Zone 2" },
          "strength": { "scheduled": true, "type": "upper_body", "timing": "After run", "duration": 30 }
        },
        "thursday": { "date": "2026-01-16", "running": { "type": "rest", "title": "Rest Day" } },
        "friday": {
          "date": "2026-01-17",
          "running": { "type": "easy", "title": "Short Easy Run", "totalDistance": 3, "estimatedDuration": 33, "hrZone": "Zone 2" },
          "strength": { "scheduled": true, "type": "core", "timing": "After run", "duration": 20 }
        },
        "saturday": { "date": "2026-01-18", "running": { "type": "cross_training", "title": "Cross Training", "estimatedDuration": 40 } },
        "sunday": { "date": "2026-01-19", "running": { "type": "long", "title": "Long Run", "totalDistance": 9, "estimatedDuration": 99, "hrZone": "Zone 2" } }
      }
    },
    {
      "weekNumber": 2,
      "weeksUntilRace": 14,
      "isRecoveryWeek": false,
      "phase": "base",
      "focus": "Continue building base, introduce tempo",
      "totalMileage": 28,
      "totalHours": 5,
      "strengthDays": 3,
      "weeklyNutrition": {
        "dailyCalories": 2850,
        "trainingCaloriesPerDay": 450,
        "macros": {
          "protein": { "grams": 178, "percentage": 25 },
          "carbs": { "grams": 356, "percentage": 50 },
          "fat": { "grams": 79, "percentage": 25 }
        }
      },
      "days": {
        "monday": {
          "date": "2026-01-20",
          "running": { "type": "easy", "title": "Easy Run", "totalDistance": 5, "estimatedDuration": 55, "hrZone": "Zone 2" },
          "strength": { "scheduled": true, "type": "lower_body", "timing": "After run", "duration": 40 }
        },
        "tuesday": {
          "date": "2026-01-21",
          "running": { "type": "tempo", "title": "Tempo Run", "description": "1.5mi warmup, 3mi tempo, 1.5mi cooldown", "totalDistance": 6, "estimatedDuration": 58, "hrZone": "Zone 3-4" }
        },
        "wednesday": {
          "date": "2026-01-22",
          "running": { "type": "easy", "title": "Easy Run", "totalDistance": 4, "estimatedDuration": 44, "hrZone": "Zone 2" },
          "strength": { "scheduled": true, "type": "upper_body", "timing": "After run", "duration": 30 }
        },
        "thursday": { "date": "2026-01-23", "running": { "type": "rest", "title": "Rest Day" } },
        "friday": {
          "date": "2026-01-24",
          "running": { "type": "easy", "title": "Short Easy Run", "totalDistance": 3, "estimatedDuration": 33, "hrZone": "Zone 2" },
          "strength": { "scheduled": true, "type": "core", "timing": "After run", "duration": 20 }
        },
        "saturday": { "date": "2026-01-25", "running": { "type": "cross_training", "title": "Cross Training", "estimatedDuration": 40 } },
        "sunday": { "date": "2026-01-26", "running": { "type": "long", "title": "Long Run", "totalDistance": 10, "estimatedDuration": 110, "hrZone": "Zone 2" } }
      }
    },
    {
      "weekNumber": 3,
      "weeksUntilRace": 13,
      "isRecoveryWeek": false,
      "phase": "base",
      "focus": "Peak base week, longest base phase volume",
      "totalMileage": 32,
      "totalHours": 5.5,
      "strengthDays": 3,
      "weeklyNutrition": {
        "dailyCalories": 2900,
        "trainingCaloriesPerDay": 500,
        "macros": {
          "protein": { "grams": 181, "percentage": 25 },
          "carbs": { "grams": 363, "percentage": 50 },
          "fat": { "grams": 81, "percentage": 25 }
        }
      },
      "days": {
        "monday": {
          "date": "2026-01-27",
          "running": { "type": "easy", "title": "Easy Run", "totalDistance": 5, "estimatedDuration": 55, "hrZone": "Zone 2" },
          "strength": { "scheduled": true, "type": "lower_body", "timing": "After run", "duration": 40 }
        },
        "tuesday": {
          "date": "2026-01-28",
          "running": { "type": "intervals", "title": "Fartlek", "description": "Easy run with 8x1min pickups at tempo pace, 1min easy between", "totalDistance": 6, "estimatedDuration": 62, "hrZone": "Zone 2-3" }
        },
        "wednesday": {
          "date": "2026-01-29",
          "running": { "type": "easy", "title": "Easy Run", "totalDistance": 5, "estimatedDuration": 55, "hrZone": "Zone 2" },
          "strength": { "scheduled": true, "type": "upper_body", "timing": "After run", "duration": 30 }
        },
        "thursday": { "date": "2026-01-30", "running": { "type": "rest", "title": "Rest Day" } },
        "friday": {
          "date": "2026-01-31",
          "running": { "type": "easy", "title": "Short Easy Run", "totalDistance": 4, "estimatedDuration": 44, "hrZone": "Zone 2" },
          "strength": { "scheduled": true, "type": "core", "timing": "After run", "duration": 20 }